Competitor,Source (PDP / Instagram / TikTok / Email / Other),Evidence (1-line: SKU title, caption text, date),Possible signal (trend / promo / tactic),Whitespace idea for Wayfair (1-line)
Amazon,PDP,"Loloi II Layla Collection: $139.99 (was $198.19, 29% off Black Friday), 4.2 stars (9,529 reviews), offers 9+ sizes including runners, traditional style, Nov 2024",tactic,"Partner with designer/influencer brands (like Magnolia Home x Loloi) to create exclusive collections that command premium pricing and drive brand loyalty"
Amazon,PDP,"WondRg brand: All products emphasize ""lavable"" (washable) in titles, low pile positioning, vintage/abstract styles, $59.99-$139.99 price range, ""OEKO-TEX"" certifications, Nov 2024",trend,"Create cohesive brand collections (vintage, abstract, neutral) with consistent messaging around washability and sustainability certifications to build brand recognition"
Amazon,PDP,"Aggressive Black Friday pricing: Loloi 29% off, GENIMO 12% off, WondRg 10-11% off, multiple ""Offre du Vendredi fou"" badges across 80%+ of listings, Nov 2024",promo,"Implement dynamic seasonal pricing strategy aligned with major shopping events (Black Friday, Prime Day) to remain competitive and capture price-sensitive customers"
Amazon,PDP,"Multi-size availability: Loloi offers 9+ sizes per design, WondRg offers 12+ sizes (2x3 to 8x10), extensive size matrix allows customers to find exact fit, Nov 2024",trend,"Expand size matrix for best-selling designs to reduce customer friction and increase conversion - customers often abandon when preferred size unavailable"
Amazon,PDP,"Sustainability messaging: ""OEKO-TEX STANDARD 100"", ""Climate Pledge Friendly"" badges displayed prominently, ""non-toxic"", ""safe chemicals"" features, Nov 2024",trend,"Obtain and prominently display sustainability certifications (OEKO-TEX, Climate Pledge) to appeal to eco-conscious consumers and differentiate from competitors"
Amazon,PDP,"Bavni Tapis: ""lavable en machine"" in title, $20.89 (was $24.99, 16% off), 4.3 stars (764 reviews), ""Plus de 50 achetés au cours du mois dernier"", Black Friday deal, Nov 2024",tactic,"Display ""X bought in past month"" social proof badges prominently in product cards to build urgency and trust, especially for budget-friendly items"
Amazon,PDP,"GENIMO: $32.55 (was $36.99, 12% off), 4.4 stars (581 reviews), offers 19 sizes (2X3 to 10X14), ""Offre du Vendredi fou"" badge, floral theme, Nov 2024",trend,"Offer extensive size ranges (15-20+ sizes) for popular designs to maximize addressable market and reduce size-related cart abandonment"
Amazon,PDP,"Pauwer Lot of 3: $49.99 for 3-piece set, ""Choix d'Amazon"" badge, 4.4 stars (233 reviews), boho style, multiple color options, Nov 2024",tactic,"Create bundle offerings (multi-piece sets) at attractive price points to increase average order value and appeal to customers furnishing multiple rooms"
Amazon,PDP,"Low pile / ultra-thin positioning: ""Poil ras"", ""ultra fin"", ""low pile"" features emphasized across 90%+ of washable rugs, Nov 2024",trend,"Segment washable rugs by pile height (low/ultra-thin vs medium) with clear filtering to help customers find products matching their comfort and cleaning preferences"
Amazon,PDP,"Pet/child-friendly messaging: ""Adapté aux enfants et aux animaux domestiques"", ""non-toxic"", ""stain-resistant"" features in product descriptions, Nov 2024",trend,"Create dedicated ""Pet-Friendly"" and ""Family-Safe"" collections with clear filtering and badges to target families with pets and young children"
Amazon,PDP,"Vintage/distressed style dominance: ""vintage"", ""vieilli"", ""distressed"", ""boho"" appear in 70%+ of rug titles, neutral color palettes (beige, taupe, grey), Nov 2024",trend,"Expand vintage/distressed rug assortment to match consumer preference for timeless, lived-in aesthetic that works across multiple design styles"
Amazon,PDP,"Price range segmentation: Budget ($20-50), Mid-tier ($50-100), Premium ($100-200), Luxury ($200+), clear price bands by size and brand, Nov 2024",tactic,"Implement clear price tiering strategy with visual indicators to help customers quickly identify products within their budget range and reduce decision fatigue"
Amazon,PDP,"Review count display: Loloi Layla 9,529 reviews, WondRg 144-176 reviews, review counts prominently shown in product titles and cards, Nov 2024",tactic,"Display review counts prominently in product listings to build trust - high review volumes signal proven products and reduce purchase hesitation"
Amazon,PDP,"Material transparency: ""100% polyester"", ""polypropylène"", ""chenille"" materials clearly stated, ""fabriqué à la machine"" construction type, Nov 2024",trend,"Provide detailed material and construction information upfront to help customers make informed decisions and set proper expectations about durability and care"
Amazon,PDP,"Color variety per design: WondRg offers 4-5 color options per rug design, Loloi offers 10+ colorways per collection, Nov 2024",trend,"Offer multiple color variations for best-selling designs to increase conversion - customers often want same style in different color to match their decor"
Amazon,PDP,"Runner size emphasis: Multiple brands offer extensive runner sizes (2x6, 2x8, 2x10, 2x12), catering to hallway and kitchen applications, Nov 2024",trend,"Expand runner rug assortment across all price points - runners are high-traffic items and customers often need multiple sizes for different spaces"
Amazon,PDP,"""Choix d'Amazon"" badge: Pauwer, WondRg products display ""Amazon's Choice"" badge, indicating algorithm-selected best matches for search queries, Nov 2024",tactic,"Optimize product listings (titles, keywords, reviews, pricing) to qualify for ""Best Match"" or ""Editor's Pick"" badges that increase visibility and conversion"
Amazon,PDP,"Installation guidance: ""Thibaude non incluse, mais fortement recommandée"" (pad recommended), size guides for rooms, placement tips in descriptions, Nov 2024",tactic,"Provide clear size guides and installation tips (rug pad recommendations, room placement) to reduce returns and improve customer satisfaction"
Amazon,PDP,"Prime member pricing: ""Prix membre Prime"" discounts ($20.89 vs $24.99), exclusive Prime pricing creates membership value, Nov 2024",tactic,"Offer member-exclusive pricing or early access to sales to incentivize loyalty program enrollment and increase customer lifetime value"
Amazon,PDP,"Video content: Product videos showing rug in room settings, unboxing, installation tips, multiple video formats per product, Nov 2024",tactic,"Add lifestyle and installation videos to product pages to help customers visualize products in their space and reduce uncertainty about purchase"
Amazon,PDP,"Bundle recommendations: ""Frequently bought together"" shows rug pad, cleaning products, related rugs, increasing average order value, Nov 2024",tactic,"Implement smart bundling recommendations (rug + pad, multiple sizes, complementary products) to increase basket size and improve customer experience"
Amazon,PDP,"AI-generated review summaries: ""Les clients apprécient la douceur"" auto-generated from reviews, highlighting key product attributes, Nov 2024",tactic,"Use AI to extract and display key review insights (top features, common concerns) to help customers quickly understand product strengths and weaknesses"
Amazon,PDP,"Stock urgency: ""Seulement 2 restant en stock"", ""Only 10 left"" creates scarcity, drives immediate purchase decisions, Nov 2024",tactic,"Display low stock indicators for products with limited inventory to create urgency and reduce cart abandonment, especially during peak shopping periods"
Amazon,PDP,"Payment options: ""Ou 46,67$/mois (3 mois)"" installment plans, ""Obtenez un rabais instantané"" credit card offers, Nov 2024",tactic,"Offer flexible payment options (installment plans, store credit) to make higher-priced items more accessible and reduce price-related objections"
Amazon,PDP,"Style categorization: ""Traditionnel"", ""Bohème"", ""Moderne"", ""Oriental"" style tags help customers filter and find matching aesthetic, Nov 2024",trend,"Implement robust style filtering (traditional, modern, boho, oriental) to help customers quickly find rugs matching their design preferences"
Amazon,PDP,"Room-specific positioning: ""pour salon, chambre à coucher, salle à manger"" multiple room use cases in titles, Nov 2024",tactic,"Include multiple room applications in product titles and descriptions to increase search visibility and show versatility of each rug design"
Amazon,PDP,"Care instructions prominence: ""Lavable en machine"", ""Facile à nettoyer"", ""Résistant aux taches"" care features in titles and bullets, Nov 2024",trend,"Emphasize ease of care (machine washable, stain-resistant) as primary selling point - convenience is key decision factor for busy families"
Amazon,PDP,"Brand store pages: WondRg, Loloi have dedicated brand stores showcasing collections, building brand recognition and cross-selling, Nov 2024",tactic,"Create brand store pages or collection landing pages to showcase related products, increase brand discovery, and drive multiple product purchases"
Amazon,PDP,"Comparison tables: Side-by-side comparison of sizes, prices, features across similar products helps customers choose, Nov 2024",tactic,"Add comparison tools or tables to help customers evaluate similar products and make confident purchase decisions, reducing returns"
Amazon,PDP,"Customer image galleries: ""Avis avec des images"" shows 10+ customer photos per product, real-world usage examples, Nov 2024",tactic,"Incentivize customers to upload photos with reviews - user-generated content shows products in real homes and builds trust more than studio shots"
Amazon,PDP,"Return policy clarity: ""Peut être retourné jusqu'au 31 janv. 2026"" extended return windows reduce purchase risk, Nov 2024",tactic,"Offer extended return windows (30-90 days) especially during holiday seasons to reduce purchase hesitation and increase conversion"

